{
  "contract_version": "1.1.0",
  "trace_id": "trc_8f21ab",
  "insight_id": "ins_20261020_U_106783_001",
  "started_at": "2026-10-20T09:11:52.100+03:00",
  "finished_at": "2026-10-20T09:12:00.480+03:00",
  "total_tokens_in": 6840,
  "total_tokens_out": 1120,
  "cost_rub": 0.41,
  "steps": [
    {
      "step_no": 1,
      "agent": "planner",
      "action": "plan",
      "title": "Составляю план проверки",
      "tool": null,
      "args": null,
      "result_summary": "Четыре шага: профиль клиента, контрагенты, отраслевая аналитика, сверка дат",
      "result_ref": null,
      "status": "ok",
      "duration_ms": 910,
      "tokens_in": 1180,
      "tokens_out": 210,
      "model": "qwen3.6-35b-a3b",
      "note": null
    },
    {
      "step_no": 2,
      "agent": "planner",
      "action": "tool_call",
      "title": "Смотрю профиль компании",
      "tool": "get_company_profile",
      "args": {
        "u_id": "U_106783"
      },
      "result_summary": "ОКВЭД 27.12, выручка 20,8 млрд, лизинг, зарплатный проект, импорт. Пустое поле: численность по СПАРК",
      "result_ref": "db://company_profile/U_106783",
      "status": "ok",
      "duration_ms": 42,
      "tokens_in": null,
      "tokens_out": null,
      "model": null,
      "note": null
    },
    {
      "step_no": 3,
      "agent": "planner",
      "action": "tool_call",
      "title": "Анализирую контрагентов",
      "tool": "get_counterparties",
      "args": {
        "u_id": "U_106783",
        "direction": "in",
        "layer": "external",
        "top_n": 10
      },
      "result_summary": "633 плательщика, топ-1 U_92777 даёт 75% потока, покрытие выручки 61%, 67% плательщиков вне периметра банка",
      "result_ref": "db://counterparty_stats/U_106783",
      "status": "ok",
      "duration_ms": 65,
      "tokens_in": null,
      "tokens_out": null,
      "model": null,
      "note": null
    },
    {
      "step_no": 4,
      "agent": "planner",
      "action": "tool_call",
      "title": "Ищу отраслевую аналитику Альфы",
      "tool": "search_alfa_analytics",
      "args": {
        "query": "инвестиции строительство промпроизводство прогноз 2026",
        "as_of_after": "2026-06-01",
        "top_k": 3
      },
      "result_summary": "Найдено 3 фрагмента. Самый свежий релевантный — Макростатистика 1П26 от 31.07.2026, с. 3",
      "result_ref": "corpus://macro_1h26#p3",
      "status": "ok",
      "duration_ms": 180,
      "tokens_in": null,
      "tokens_out": null,
      "model": null,
      "note": null
    },
    {
      "step_no": 5,
      "agent": "planner",
      "action": "tool_call",
      "title": "Сверяю актуальность показателей",
      "tool": "get_indicator_timeline",
      "args": {
        "name": "key_rate_end_2026_forecast"
      },
      "result_summary": "Пять версий прогноза. Актуальная — 14,0% от 11.09.2026; три более ранних документа с 13,5% помечены superseded",
      "result_ref": "corpus://policy_rate#p1",
      "status": "superseded",
      "duration_ms": 12,
      "tokens_in": null,
      "tokens_out": null,
      "model": null,
      "note": "Отброшены значения из macro_1h26, consumption и macro_7m26 как устаревшие"
    },
    {
      "step_no": 6,
      "agent": "analyst",
      "action": "llm_call",
      "title": "Формулирую вывод",
      "tool": null,
      "args": null,
      "result_summary": "Черновик инсайта: три последствия, одно мнение банка, одно допущение модели",
      "result_ref": null,
      "status": "ok",
      "duration_ms": 4200,
      "tokens_in": 3890,
      "tokens_out": 640,
      "model": "deepseek-v4.1-flash",
      "note": null
    },
    {
      "step_no": 7,
      "agent": "critic",
      "action": "self_check",
      "title": "Проверяю себя",
      "tool": null,
      "args": null,
      "result_summary": "Забраковано: утверждение о доле выручки от ключевого покупателя не подтверждено — банк видит 61%, а не весь оборот",
      "result_ref": null,
      "status": "failed",
      "duration_ms": 1310,
      "tokens_in": 1420,
      "tokens_out": 180,
      "model": "qwen3.6-35b-a3b",
      "note": "Нарушено правило 4: формулировка «доля выручки» применительно к платежам"
    },
    {
      "step_no": 8,
      "agent": "analyst",
      "action": "retry",
      "title": "Переписываю формулировку",
      "tool": null,
      "args": null,
      "result_summary": "«Доля выручки» заменена на «доля в наблюдаемом банком потоке», добавлено примечание о покрытии 61%",
      "result_ref": null,
      "status": "ok",
      "duration_ms": 1480,
      "tokens_in": 350,
      "tokens_out": 90,
      "model": "deepseek-v4.1-flash",
      "note": null
    },
    {
      "step_no": 9,
      "agent": "critic",
      "action": "self_check",
      "title": "Проверяю повторно",
      "tool": null,
      "args": null,
      "result_summary": "Шесть из шести пунктов пройдены: все числа найдены в ответах инструментов, у каждого вывода есть evidence_id",
      "result_ref": null,
      "status": "ok",
      "duration_ms": 180,
      "tokens_in": null,
      "tokens_out": null,
      "model": null,
      "note": null
    }
  ]
}
